{
  "schema_version": 1,
  "mock": true,
  "notice": "SYNTHETIC DEMO ONLY - NOT REAL ACCOUNT STATUS OR AUTHORIZATION",
  "providers": [
    {
      "id": "MOCK-AWS",
      "provider": "AWS",
      "official_documentation": "https://docs.aws.amazon.com/",
      "phase": "research",
      "status": "planned",
      "approval_reference": "NOT_REQUESTED",
      "human_assignee": "UNASSIGNED",
      "verification_result": "NOT_RUN",
      "action": "MOCK: Review onboarding prerequisites",
      "reason": "MOCK: Demonstrate safe human handoff planning",
      "prerequisites": "MOCK: Verify scope and owner identity privately",
      "cost_assessment": "MOCK: Not assessed; no spend authorized",
      "permissions_assessment": "MOCK: None granted",
      "credit_status": "MOCK: Unknown; not promised",
      "acceptance_check": "MOCK: Review synthetic evidence only",
      "outcome": "MOCK: No live provider action performed",
      "automatic_approval": false,
      "live_actions_executed": false
    },
    {
      "id": "MOCK-AZURE",
      "provider": "Azure",
      "official_documentation": "https://learn.microsoft.com/en-us/azure/",
      "phase": "owner_approval",
      "status": "blocked",
      "approval_reference": "NOT_REQUESTED",
      "human_assignee": "UNASSIGNED",
      "verification_result": "NOT_RUN",
      "action": "MOCK: Review onboarding prerequisites",
      "reason": "MOCK: Demonstrate safe human handoff planning",
      "prerequisites": "MOCK: Verify scope and owner identity privately",
      "cost_assessment": "MOCK: Not assessed; no spend authorized",
      "permissions_assessment": "MOCK: None granted",
      "credit_status": "MOCK: Unknown; not promised",
      "acceptance_check": "MOCK: Review synthetic evidence only",
      "outcome": "MOCK: No live provider action performed",
      "automatic_approval": false,
      "live_actions_executed": false
    },
    {
      "id": "MOCK-GOOGLE-CLOUD",
      "provider": "Google Cloud",
      "official_documentation": "https://docs.cloud.google.com/docs",
      "phase": "human_security_handoff",
      "status": "blocked",
      "approval_reference": "MOCK-APPROVAL-REFERENCE",
      "human_assignee": "MOCK-VERIFIED-HUMAN",
      "verification_result": "NOT_RUN",
      "action": "MOCK: Review onboarding prerequisites",
      "reason": "MOCK: Demonstrate safe human handoff planning",
      "prerequisites": "MOCK: Verify scope and owner identity privately",
      "cost_assessment": "MOCK: Not assessed; no spend authorized",
      "permissions_assessment": "MOCK: None granted",
      "credit_status": "MOCK: Unknown; not promised",
      "acceptance_check": "MOCK: Review synthetic evidence only",
      "outcome": "MOCK: No live provider action performed",
      "automatic_approval": false,
      "live_actions_executed": false
    },
    {
      "id": "MOCK-CLOUDFLARE",
      "provider": "Cloudflare",
      "official_documentation": "https://developers.cloudflare.com/",
      "phase": "authorized_verification",
      "status": "ready_for_mock_review",
      "approval_reference": "MOCK-APPROVAL-REFERENCE",
      "human_assignee": "MOCK-VERIFIED-HUMAN",
      "verification_result": "NOT_RUN",
      "action": "MOCK: Review onboarding prerequisites",
      "reason": "MOCK: Demonstrate safe human handoff planning",
      "prerequisites": "MOCK: Verify scope and owner identity privately",
      "cost_assessment": "MOCK: Not assessed; no spend authorized",
      "permissions_assessment": "MOCK: None granted",
      "credit_status": "MOCK: Unknown; not promised",
      "acceptance_check": "MOCK: Review synthetic evidence only",
      "outcome": "MOCK: No live provider action performed",
      "automatic_approval": false,
      "live_actions_executed": false
    },
    {
      "id": "MOCK-LLM",
      "provider": "LLM providers",
      "official_documentation": "MOCK: Provider selection pending",
      "phase": "authorized_verification",
      "status": "verified_mock",
      "approval_reference": "MOCK-APPROVAL-REFERENCE",
      "human_assignee": "MOCK-VERIFIED-HUMAN",
      "verification_result": "MOCK-PASS",
      "action": "MOCK: Review onboarding prerequisites",
      "reason": "MOCK: Demonstrate safe human handoff planning",
      "prerequisites": "MOCK: Verify scope and owner identity privately",
      "cost_assessment": "MOCK: Not assessed; no spend authorized",
      "permissions_assessment": "MOCK: None granted",
      "credit_status": "MOCK: Unknown; not promised",
      "acceptance_check": "MOCK: Review synthetic evidence only",
      "outcome": "MOCK: No live provider action performed",
      "automatic_approval": false,
      "live_actions_executed": false
    }
  ]
}
